Exposure Weight,Ticker,Description,Exposure Value(Notional + GL),Market Value,Shares/Contracts
-43.78%,--,NASDAQ BIOTECHNOLOGY INDEX SWAP CITIBANK NA,"-1,048,904",--,-177
-41.80%,--,NASDAQ BIOTECHNOLOGY INDEX SWAP SOCIETE GENERALE,"-1,001,496",--,-169
-38.84%,--,NASDAQ BIOTECHNOLOGY INDEX SWAP UBS AG,"-930,384",--,-157
-37.85%,--,NASDAQ BIO INDEX SWAP BNP PARIBAS,"-906,680",--,-153
-37.60%,--,NASDAQ BIOTECHNOLOGY INDEX SWAP BANK OF AMERICA NA,"-900,754",--,-152
--,--,NET OTHER ASSETS (LIABILITIES),--,"$2,395,643.10","2,395,643"