Exposure Weight,Ticker,Description,Exposure Value(Notional + GL),Market Value,Shares/Contracts
-65.26%,--,VANGUARD FTSE EUROPE (VGK) SWAP GOLDMAN SACHS INTERNATIONAL,"-12,267,426",--,"-3,110"
-51.81%,--,VANGUARD FTSE EUROPE (VGK) SWAP UBS AG,"-9,739,303",--,"-2,469"
-42.68%,--,VANGUARD FTSE EUROPE (VGK) SWAP SOCIETE GENERALE,"-8,023,133",--,"-2,034"
-40.12%,--,VANGUARD FTSE EUROPE (VGK) SWAP CITIBANK NA,"-7,541,903",--,"-1,912"
--,--,NET OTHER ASSETS (LIABILITIES),--,"$18,797,463.58","18,797,464"