Exposure Weight,Ticker,Description,Exposure Value(Notional + GL),Market Value,Shares/Contracts
62.19%,--,VANGUARD FTSE EUROPE (VGK) SWAP CITIBANK NA,"8,579,309",--,"2,175"
58.56%,--,VANGUARD FTSE EUROPE (VGK) SWAP BANK OF AMERICA NA BANK OF AMERICA NA,"8,079,027",--,"2,048"
41.80%,--,VANGUARD FTSE EUROPE (VGK) SWAP GOLDMAN SACHS INTERNATIONAL,"5,766,874",--,"1,462"
30.74%,--,VANGUARD FTSE EUROPE (VGK) SWAP UBS AG,"4,240,348",--,"1,075"
7.06%,--,VANGUARD FTSE EUROPE (VGK) SWAP SOCIETE GENERALE,"974,294",--,247
--,--,NET OTHER ASSETS (LIABILITIES),--,"$13,796,211.61","13,796,212"